CAMEOCode,Description1, MAKE PUBLIC STATEMENT10,Make statement not specified below11, Decline comment12, Make pessimistic comment13, Make optimistic comment14, Consider policy option15, Acknowledge or claim responsibility16, Make empathetic comment17, Engage in symbolic act18, Express accord2, APPEAL20,Appeal not specified below21,Appeal for cooperation not specified below211, Appeal for diplomatic cooperation212, Appeal for material cooperation22, Appeal for policy support23,Appeal for aid not specified below231, Appeal for economic aid232, Appeal for military aid233, Appeal for humanitarian aid234, Appeal for military protection or peacekeeping24,Appeal for political reform not specified below241, Appeal for change in leadership242, Appeal for policy change243, Appeal for rights244,Appeal for change in institutions regime25, Appeal to yield26, Appeal to others to meet or negotiate27, Appeal to others to settle dispute28, Appeal to others to engage in mediation3, EXPRESS INTENT TO COOPERATE30,Express intent to cooperate not specified below31,Express intent to engage in material cooperation  not specified below311, Express intent to cooperate economically312, Express intent to cooperate militarily32, Express intent to provide policy support33,Express intent to provide aid not specified below331, Express intent to provide economic aid332, Express intent to provide military aid333, Express intent to provide humanitarian aid334, Express intent to provide military protection or peacekeeping34,Express intent to bring political reform not specified below341, Express intent to change leadership342, Express intent to change policy343, Express intent to provide rights344,Express intent to change institutions regime35,Express intent to yield not specified below351, Express intent to ease administrative sanctions352, Express intent to stop protests353, Express intent to accede to political demands354, Express intent to release persons or property355,Express intent to ease economic sanctions boycott or embargo356, Express intent allow international involvement (not mediation)357, Express intent to de-escalate military engagement 36, Express intent to meet or negotiate37, Express intent to settle dispute38, Express intent to accept mediation39, Express intent to mediate4, CONSULT40,Consult not specified below41, Discuss by telephone42, Make a visit43, Host a visit44, Meet at a _‚œthird_‚¢ location45, Mediate46, Engage in negotiation5, ENGAGE IN DIPLOMATIC COOPERATION50,Engage in diplomatic cooperation not specified below51, Praise or endorse52, Defend verbally53, Rally support on behalf of54, Grant diplomatic recognition55, Apologize56, Forgive57, Sign formal agreement ,6, ENGAGE IN MATERIAL COOPERATION60,Engage in material cooperation not spec below61, Cooperate economically62, Cooperate militarily63, Engage in judicial cooperation64, Share intelligence or information7, PROVIDE AID70,Provide aid not specified below71, Provide economic aid72, Provide military aid73, Provide humanitarian aid74, Provide military protection or peacekeeping75, Grant asylum8, YIELD80,Yield not specified below 81,Ease administrative sanctions not specified below811, Ease restrictions on freedoms of speech and expression 812, Ease ban on political parties or politicians813, Ease curfew814, Ease state of emergency or martial law82, Ease popular protest 83, Accede to demands for political reform 831, Accede to demands for change in leadership832, Accede to demands for change in policy833, Accede to demands for rights834,Accede to demands for change in institutions regime84,Return release not specified below841,Return release person(s)842,Return release property85,Ease economic sanctions boycott embargo86, Allow international involvement861, Receive deployment of peacekeepers862, Receive inspectors863, Allow delivery of humanitarian aid87, De-escalate military engagement871,Declare truce ceasefire872, Ease military blocka[-2.0]de873, Demobilize armed forces874, Retreat or surrender militarily9, INVESTIGATE90,Investigate not specified below91,Investigate crime corruption92, Investigate human rights abuses93, Investigate military action94, Investigate war crimes10, DEMAND100,Demand not specified below101,Demand information investigation102, Demand policy support103,Demand aid protection or peacekeeping104,Demand political reform not specified below1041, Demand change in leadership1042, Demand policy change1043, Demand rights1044,Demand change in institutions regime105, Demand mediation106, Demand withdrawal107, Demand ceasefire108,Demand meeting negotiation11, DISAPPROVE110,Disapprove not specified below111, Criticize or denounce 112,Accuse not specified below1121,Accuse of crime corruption1122, Accuse of human rights abuses1123, Accuse of aggression1124, Accuse of war crimes1125,Accuse of espionage treason113, Rally opposition against114, Complain officially 115, Bring lawsuit against  ,12, REJECT120,Reject not specified below121,Reject proposal not specified below1211,Reject ceasefire withdrawal1212, Reject peacekeeping1213, Reject settlement122, Reject request for material aid123, Reject demands for political reform 1231, Reject demands for change in leadership1232, Reject demands for policy change1233, Reject demand for rights1234,Reject demand change in institutions regime124,Reject proposal to meet discuss or negotiate125, Reject mediation126,Defy norms law127,Reject accusation deny responsibility128, Veto 13, THREATEN130,Threaten not specified below131,Threaten non-force not specified below1311, Threaten to reduce or stop aid1312,Threaten to boycott embargo or sanction1313, Threaten to reduce or break relations132,Threaten with administrative sanctions not specified below1321, Threaten to impose restrictions on freedoms of speech and expression 1322, Threaten to ban political parties or politicians1323, Threaten to impose curfew1324, Threaten to impose state of emergency or martial law133, Threaten collective dissent134, Threaten to halt negotiations135, Threaten to halt mediation136, Threaten to expel or withdraw peacekeepers137, Threaten with violent repression138,Threaten to use military force not specified below1381, Threaten blockade1382, Threaten occupation 1383, Threaten unconventional violence 1384, Threaten conventional attack  1385, Threaten attack with WMD139, Give ultimatum14, PROTEST140,Engage in popular protest not specified below141, Demonstrate or rally1411, Demonstrate for change in leadership1412, Demonstrate for policy change1413, Demonstrate for rights1414,Demonstrate for change in institutions regime142,Conduct hunger strike not specified below1421, Conduct hunger strike for change in leadership1422, Conduct hunger strike for policy change1423, Conduct hunger strike for rights1424,Conduct hunger strike for change in institutions regime 143,Conduct strike or boycott not specified below1431, Conduct strike or boycott for change in leadership   1432, Conduct strike or boycott for policy change1433, Conduct strike or boycott for rights1434,Conduct strike or boycott for change in institutions regime144,Obstruct passage block1441, Obstruct passage to demand change in  leadership   1442, Obstruct passage to demand policy change1443, Obstruct passage to demand rights1444,Obstruct passage to demand change in institutions regime145,Protest violently riot1451, Obstruct passage to demand change in  leadership   1452, Obstruct passage to demand policy change1453, Obstruct passage to demand rights1454,Obstruct passage to demand change in institutions regime15, EXHIBIT FORCE POSTURE150,Demonstrate military or police power not specified below151, Increase police alert status152, Increase military alert status153, Mobilize or increase police power154, Mobilize or increase armed forces 16, REDUCE RELATIONS160,Reduce relations not specified below161, Reduce or break diplomatic relations162,Reduce or stop aid not specified below1621, Reduce or stop economic assistance1622, Reduce or stop military assistance1623, Reduce or stop humanitarian assistance163, Halt negotiations164,Expel or withdraw not specified below1641, Expel or withdraw peacekeepers1642,Expel or withdraw inspectors observers1643, Expel or withdraw aid agencies165, Halt mediation166,Impose embargo boycott or sanctions17, COERCE170,Coerce not specified below 171,Seize or damage property not specified below1711, Confiscate property1712, Destroy property172,Impose administrative sanctions not specified below1721, Impose restrictions on freedoms of speech and expression 1722, Ban political parties or politicians1723, Impose curfew1724, Impose state of emergency or martial law173,Arrest detain or charge with legal action 174, Expel or deport individuals175, Use violent repression  18, ASSAULT180,Use unconventional violence not specified below181,Abduct hijack or take hostage 182,Physically assault not specified below1821, Sexually assault1822, Torture1823, Kill by physical assault183,Conduct suicide car or other non-military bombing not spec below1831, Carry out suicide bombing1832, Carry out car bombing1833, Carry out roadside bombing 184, Use as human shield 185, Attempt to assassinate186, Assassinate 19, FIGHT190,Use conventional military force not specified below191,Impose blockade restrict movement 192, Occupy territory193, Fight with small arms and light weapons194, Fight with artillery and tanks195, Employ aerial weapons196, Violate ceasefire  ,20, ENGAGE IN UNCONVENTIONAL MASS  VIOLENCE200,Engage in unconventional mass violence not specified below201, Engage in mass expulsion202, Engage in mass killings203, Engage in ethnic cleansing204,Use weapons of mass destruction not specified below2041,Use chemical biological or radiologicalweapons2042, Detonate nuclear weapons